{
  "schema_version": "1.0",
  "pack_ref": "pack0-meetcore@0.0.1",
  "pack_sha256": "143a6b475a7651b98851d050ae87fff630cb18d8143337a7669f2b925b9023cc",
  "result": "pass",
  "checks": {
    "pack0_validate": true
  },
  "failures": [],
  "actor_id": "unknown",
  "trace_id": "V011SIM_RR",
  "env_fingerprint": "python=3.11.8",
  "timestamp": "2026-01-22T15:15:49Z"
}